{
  "$schema": "http://json-schema.org/draft-07/schema#",
  "title": "HTTP Forge Configuration",
  "description": "Configuration file for HTTP Forge VS Code extension",
  "type": "object",
  "properties": {
    "version": {
      "type": "string",
      "description": "Configuration file version",
      "default": "1.0"
    },
    "storage": {
      "type": "object",
      "description": "Storage configuration for collections and data",
      "properties": {
        "format": {
          "type": "string",
          "enum": ["folder", "json"],
          "default": "folder",
          "description": "Storage format for collections. 'folder' stores each request as a folder with separate files for meta.json and body. 'json' stores collections as single JSON files."
        },
        "root": {
          "type": "string",
          "default": "./.http-forge/assets",
          "description": "Root directory for HTTP Forge data (collections, environments, flows, suites)"
        },
        "history": {
          "type": "string",
          "default": "./.http-forge/.cache/histories",
          "description": "Directory for request history storage (can be gitignored)"
        },
        "results": {
          "type": "string",
          "default": "./.http-forge/.cache/results",
          "description": "Directory for test suite results storage (can be gitignored)"
        }
      }
    },
    "request": {
      "type": "object",
      "description": "Default HTTP request settings",
      "properties": {
        "timeout": {
          "type": "number",
          "default": 30000,
          "description": "Default request timeout in milliseconds"
        },
        "followRedirects": {
          "type": "boolean",
          "default": true,
          "description": "Whether to follow HTTP redirects"
        },
        "maxRedirects": {
          "type": "number",
          "default": 10,
          "description": "Maximum number of redirects to follow"
        },
        "strictSSL": {
          "type": "boolean",
          "default": true,
          "description": "Whether to verify SSL certificates"
        },
        "tls": {
          "type": "object",
          "description": "Default TLS settings for HTTPS requests",
          "properties": {
            "caPath": {
              "type": "string",
              "description": "Path to CA certificate bundle (PEM), relative to workspace root or absolute"
            },
            "certPath": {
              "type": "string",
              "description": "Path to client certificate (PEM), relative to workspace root or absolute"
            },
            "keyPath": {
              "type": "string",
              "description": "Path to client private key (PEM), relative to workspace root or absolute"
            },
            "pfxPath": {
              "type": "string",
              "description": "Path to client certificate bundle (PFX/P12), relative to workspace root or absolute"
            },
            "passphrase": {
              "type": "string",
              "description": "Passphrase for key/pfx if required"
            },
            "servername": {
              "type": "string",
              "description": "Optional SNI servername override"
            }
          }
        },
        "certificates": {
          "type": "array",
          "description": "Host-based client certificate mappings (Postman-style global certificates)",
          "items": {
            "type": "object",
            "required": ["host"],
            "properties": {
              "host": {
                "type": "string",
                "description": "Host matcher: exact host (api.example.com), wildcard (*.example.com), or *"
              },
              "port": {
                "type": "number",
                "description": "Optional port matcher (defaults to 443 for HTTPS)"
              },
              "enabled": {
                "type": "boolean",
                "default": true,
                "description": "Enable/disable this certificate mapping"
              },
              "caPath": {
                "type": "string",
                "description": "Path to CA certificate bundle (PEM), relative to workspace root or absolute"
              },
              "certPath": {
                "type": "string",
                "description": "Path to client certificate (PEM), relative to workspace root or absolute"
              },
              "keyPath": {
                "type": "string",
                "description": "Path to client private key (PEM), relative to workspace root or absolute"
              },
              "pfxPath": {
                "type": "string",
                "description": "Path to client certificate bundle (PFX/P12), relative to workspace root or absolute"
              },
              "passphrase": {
                "type": "string",
                "description": "Passphrase for key/pfx if required"
              },
              "servername": {
                "type": "string",
                "description": "Optional SNI servername override"
              }
            }
          }
        }
      }
    },
    "scripts": {
      "type": "object",
      "description": "Script execution settings",
      "properties": {
        "modulePaths": {
          "type": "array",
          "items": {
            "type": "string"
          },
          "default": ["./.http-forge/assets/src", "./.http-forge/assets/lib"],
          "description": "Paths to search for custom modules in pre/post request scripts. Relative to workspace root."
        },
        "scope": {
          "type": "string",
          "enum": ["shared", "isolated"],
          "default": "shared",
          "description": "Script scope mode. 'shared' (default): all script levels and the pre/post phases share one JavaScript scope. 'isolated': each script level runs in its own scope (Postman-compatible); state passes through pm.variables/pm.environment/pm.globals."
        },
        "timeout": {
          "type": "number",
          "minimum": 0,
          "default": 5000,
          "description": "Per-script timeout in milliseconds. Bounds both the synchronous script CPU guard and the async event-loop drain budget (pending setTimeout / un-awaited Promises) the runner waits on before advancing to the next request."
        }
      }
    },
    "runner": {
      "type": "object",
      "description": "Collection runner and test suite settings",
      "properties": {
        "resultsRetentionDays": {
          "type": "number",
          "default": 7,
          "description": "Number of days to retain test results"
        },
        "indexPageSize": {
          "type": "number",
          "default": 1000,
          "description": "Number of entries per index page"
        },
        "recentErrorsLimit": {
          "type": "number",
          "default": 20,
          "description": "Maximum number of recent errors to track"
        }
      }
    },
    "environments": {
      "type": "object",
      "description": "Environment settings",
      "properties": {
        "default": {
          "type": "string",
          "description": "Name of the default environment to use"
        }
      }
    },
    "restClientExport": {
      "type": "object",
      "description": "Preferences for exporting collections to REST‑Client format.",
      "properties": {
        "path": {
          "type": "string",
          "description": "Output path for exported REST‑Client files.  If relative it is resolved against the workspace root.",
          "default": "collections-rest-client"
        },
        "mergeGlobals": {
          "type": "boolean",
          "description": "Merge global environment variables into each exported environment file.",
          "default": true
        }
      }
    },
      "discovery": {
        "type": "object",
        "description": "Source-code discovery configuration (framework hints, custom seed loader, component analysis).",
        "properties": {
          "customSeedLoaderModulePath": {
            "type": "string",
            "description": "Absolute or workspace-relative path to a custom seed loader module. When set, hybrid seed loading is enabled.",
            "default": ""
          },
          "frameworks": {
            "type": "array",
            "items": {
              "type": "string",
              "enum": ["auto", "express", "fastify", "nestjs", "lambda"]
            },
            "description": "Framework detection hints (e.g. ['express'] or ['auto']).",
            "default": ["auto"]
          },
          "contextProperties": {
            "type": "array",
            "items": { "type": "string" },
            "description": "List of request/response context properties to inspect during component analysis (e.g. ['locals']).",
            "default": ["locals"]
          },
          "skipComponentAnalysis": {
            "type": "boolean",
            "description": "When true, skip component dependency analysis during discovery (faster, less detail).",
            "default": false
          }
        },
        "additionalProperties": false
      },
    "mcp": {
      "type": "object",
      "description": "Embedded MCP server configuration (port, exposed collections/suites, tool-list shape, and CORS).",
      "properties": {
        "port": {
          "type": "integer",
          "minimum": 1,
          "maximum": 65535,
          "default": 3100,
          "description": "Port for the embedded MCP HTTP server. Runtime callers can override this."
        },
        "excludedCollections": {
          "type": "array",
          "items": { "type": "string" },
          "default": [],
          "description": "Collection IDs or names to hide from MCP tools. Empty = expose all collections."
        },
        "excludedSuites": {
          "type": "array",
          "items": { "type": "string" },
          "default": [],
          "description": "Suite IDs or names to hide from MCP tools. Empty = expose all suites."
        },
        "toolPrefix": {
          "type": "string",
          "default": "",
          "description": "Optional prefix added to every MCP tool name, e.g. \"acme_\"."
        },
        "maxRequestsPerCall": {
          "type": "integer",
          "minimum": 1,
          "default": 500,
          "description": "Maximum number of requests the MCP server executes in a single collection or suite call."
        },
        "toolMode": {
          "type": "string",
          "enum": ["flat", "drilldown", "auto", "execution-only"],
          "default": "auto",
          "description": "Tool-list shape. 'auto' uses flat below drilldownThreshold, then switches to drilldown."
        },
        "drilldownThreshold": {
          "type": "integer",
          "minimum": 0,
          "default": 100,
          "description": "When toolMode is 'auto', switch to drilldown once the request-tool count exceeds this value."
        },
        "toolPageSize": {
          "type": "integer",
          "minimum": 0,
          "default": 200,
          "description": "Maximum tools per tools/list page in flat mode. 0 disables pagination."
        },
        "cors": {
          "type": "object",
          "description": "CORS configuration for the embedded MCP server.",
          "properties": {
            "allowedOrigins": {
              "type": "array",
              "items": { "type": "string" },
              "default": ["http://localhost", "http://127.0.0.1"],
              "description": "Origins allowed to access the MCP server."
            }
          },
          "additionalProperties": false
        }
      },
      "additionalProperties": false
    },
    "secrets": {
      "type": "object",
      "description": "Secret provider aliases used by {{secret:alias/path}} tokens. Built-in providers use ambient credential chains; custom providers load a workspace module. Prefer environment variables over storing credentials here.",
      "properties": {
        "providers": {
          "type": "object",
          "description": "Map of alias -> provider configuration. The key is the alias used in {{secret:<alias>/<path>}}.",
          "additionalProperties": {
            "type": "object",
            "required": ["provider"],
            "properties": {
              "provider": {
                "type": "string",
                "enum": ["aws", "azure", "gcp", "vault", "1password", "doppler", "custom"],
                "description": "Secret provider implementation."
              },
              "region": {
                "type": "string",
                "description": "AWS region (aws). Falls back to AWS_DEFAULT_REGION / AWS_REGION."
              },
              "vaultUrl": {
                "type": "string",
                "description": "Azure Key Vault URL (azure), e.g. https://myvault.vault.azure.net. Falls back to AZURE_KEYVAULT_URL."
              },
              "projectId": {
                "type": "string",
                "description": "GCP project ID (gcp). Falls back to GOOGLE_CLOUD_PROJECT / GCLOUD_PROJECT / GCP_PROJECT."
              },
              "address": {
                "type": "string",
                "description": "HashiCorp Vault address (vault). Falls back to VAULT_ADDR."
              },
              "mountPath": {
                "type": "string",
                "default": "secret",
                "description": "HashiCorp Vault KV v2 mount path (vault). Defaults to 'secret'."
              },
              "namespace": {
                "type": "string",
                "description": "HashiCorp Vault Enterprise/HCP namespace (vault). Falls back to VAULT_NAMESPACE."
              },
              "vault": {
                "type": "string",
                "description": "Default 1Password vault name (1password). When set, tokens may omit the vault segment."
              },
              "account": {
                "type": "string",
                "description": "1Password desktop-app account name (1password). Used with @1password/sdk DesktopAuth when OP_SERVICE_ACCOUNT_TOKEN is not set. Requires the desktop app and SDK 0.5.0+. Omit to use the op CLI session."
              },
              "serviceToken": {
                "type": "string",
                "description": "Doppler service token (doppler). Prefer the DOPPLER_TOKEN environment variable over storing a token here."
              },
              "module": {
                "type": "string",
                "description": "Custom resolver module path or package name (custom). Resolved from the first scripts.modulePaths entry that contains a package.json. The module must export a resolver factory function, a createResolver function, or an object with resolve(path)."
              },
              "options": {
                "type": "object",
                "description": "Non-sensitive options passed to the custom resolver factory (custom).",
                "additionalProperties": true
              }
            },
            "additionalProperties": false
          }
        }
      },
      "additionalProperties": false
    },
    "proxy": {
      "type": ["object", "null"],
      "description": "Proxy configuration (null to disable). Requests are tunnelled through the proxy using native Node.js http/https — no extra packages required.",
      "properties": {
        "enabled": {
          "type": "boolean",
          "description": "Toggle the proxy on or off without removing the configuration. Defaults to true when the proxy object is present.",
          "default": true
        },
        "http": {
          "type": "string",
          "description": "Full URL of the HTTP proxy, e.g. \"http://proxy.corp.com:8080\". Credentials can be embedded: \"http://user:pass@proxy.corp.com:8080\"."
        },
        "https": {
          "type": "string",
          "description": "Full URL of the HTTPS proxy (used for HTTPS targets). Falls back to \"http\" if omitted."
        },
        "bypass": {
          "type": "array",
          "items": { "type": "string" },
          "description": "Host patterns to skip the proxy. Supports exact match (\"api.local\"), wildcard subdomain (\"*.corp.com\"), or catch-all (\"*\").",
          "default": []
        }
      },
      "additionalProperties": false
    }
  },
  "required": ["version"]
}
